name,description,link
Active Minds Inc.,Active Minds Inc. has compiled an extensive collection of mental health resources,http://activeminds.org/issues-a-resources/mental-health-resources
National Suicide Prevention Lifeline,"Provides 24/7, free and confidential support.",http://suicidepreventionlifeline.org/
The Samaritans,"The oldest and largest suicide prevention, crisis response network in the world",http://samaritansnyc.org/
The Trevor Project,Crisis Intervention and Suicide prevention for LGBTQ youth,http://www.thetrevorproject.org/
NYC Well,"NYC Well is your connection to free, confidential mental health support. Speak to a counselor via phone, text or chat and get access to mental health and substance misuse services, in more than 200 languages, 24/7/365.",https://nycwell.cityofnewyork.us/en/
TherapySafetyNet,See their site for a collection of mental health resources for uninsured New Yorkers,https://therapysafetynet.org/resources/additional-resources-uninsured/
Alcoholics Anonymous,Alcoholics Anonymous is an international fellowship of men and women who have had a drinking problem. Membership is open to anyone who wants to do something about his or her drinking problem.,http://www.aa.org/
Substance Abuse and Mental Health Services Administration,The agency within the U.S. Department of Health and Human Services that leads public health efforts to advance the behavioral health of the nation,https://www.samhsa.gov/
National Eating Disorders Association,The leading non-profit organization in the United States advocating on behalf of and supporting individuals and families affected by eating disorders,http://www.nationaleatingdisorders.org/