name,description,link
CPS,"Confidential counseling, consultation, and crisis intervention for the Columbia community",https://health.columbia.edu/counseling-and-psychological-services
Furman,Free and confidential short-term counseling for Barnard students,https://barnard.edu/counsel
SVR,"Trauma-informed, confidential support focused on interpersonal violence and harassment",https://health.columbia.edu/sexual-violence-response
Nightline,"Anonymous peer listening service",http://blogs.cuit.columbia.edu/nightline/
GS Peer Advising,"Discuss academics, campus resources, and personal concerns",https://gs.columbia.edu/peer-advising
